{
  "schema_version": 3,
  "id": "fab",
  "profile_version": "1.0.0",
  "application": {"family": "epic-fab", "versions": []},
  "display_name": "Fab marketplace",
  "selectors": [
    {"application_names": ["chrome.exe", "msedge.exe", "firefox.exe"], "window_title_contains": ["Fab", "Epic Games"]},
    {"application_names": ["EpicGamesLauncher.exe"]},
    {"url_hosts": ["fab.com", "store.epicgames.com"]}
  ],
  "surfaces": [
    {"id": "listing", "label": "Asset listing", "role": "asset_store", "route": "browser_dom", "targets": [{"id": "asset_card", "label": "Asset card", "role": "asset_listing", "supported_actions": ["inspect", "open"]}, {"id": "search", "label": "Fab search", "role": "search", "names": ["Search"], "localized_names": {"zh-CN": ["搜索"], "zh-TW": ["搜尋"], "ja-JP": ["検索"], "ko-KR": ["검색"], "de-DE": ["Suchen"], "fr-FR": ["Rechercher"], "es-ES": ["Buscar"], "pt-BR": ["Pesquisar"]}, "supported_actions": ["set_text", "submit"]}]},
    {"id": "account", "label": "Fab account", "role": "account", "route": "browser_dom", "targets": [{"id": "account_state", "label": "Account state", "role": "status", "supported_actions": ["inspect"]}]},
    {"id": "download", "label": "Download flow", "role": "download", "route": "browser_dom", "targets": [{"id": "download_button", "label": "Download", "role": "button", "supported_actions": ["request_confirmation", "click"], "fallback": {"profile_id": "fab", "surface_id": "launcher_download"}}, {"id": "confirmation", "label": "Download confirmation", "role": "dialog", "supported_actions": ["inspect", "accept", "dismiss"]}]},
    {"id": "launcher_download", "label": "Epic Games Launcher download", "role": "download", "route": "visual_fallback", "targets": [{"id": "library_item", "label": "Library item", "role": "asset", "supported_actions": ["inspect", "open"]}, {"id": "download_button", "label": "Download or install", "role": "button", "names": ["Download", "Install"], "localized_names": {"zh-CN": ["下载", "安装"], "zh-TW": ["下載", "安裝"], "ja-JP": ["ダウンロード", "インストール"], "ko-KR": ["다운로드", "설치"], "de-DE": ["Herunterladen", "Installieren"], "fr-FR": ["Télécharger", "Installer"], "es-ES": ["Descargar", "Instalar"], "pt-BR": ["Baixar", "Instalar"]}, "supported_actions": ["inspect", "click"]}, {"id": "human_verification", "label": "Human verification", "role": "dialog", "names": ["Verify you are human"], "localized_names": {"zh-CN": ["请验证您是真人"], "zh-TW": ["請驗證您是真人"], "ja-JP": ["人間であることを確認してください"], "ko-KR": ["사람인지 확인해 주세요"], "de-DE": ["Bestätigen Sie, dass Sie ein Mensch sind"], "fr-FR": ["Vérifiez que vous êtes humain"], "es-ES": ["Verifica que eres humano"], "pt-BR": ["Verifique se você é humano"]}, "supported_actions": ["inspect", "request_confirmation", "click"]}]}
  ],
  "settings": {"dialog_style": "application_rendered", "preferred_route": "browser_dom", "default_locale": "en", "destructive_confirmation_required": true}
}
